category,text
Homophobic,In front of camera everyone will speak.. if anything happens in their family they will shout roll and cry. Do they allow their child to be like this. Stupid fellows.
None-of-the-above,"this is the my first day of ur videos ,😎Sir"
None-of-the-above,Jaffer Sherif hi u get good person quickly my wishes by vasanth
None-of-the-above,Nice all the best
None-of-the-above,Subscribe paniten cried a lot nailed it♥️♥️♥️♥️♥️♥️♥️💞
Hope-Speech,great work bro waiting for a good end
Counter-speech,Really sema... 😍❤... But try to telecast in television also... Innum uneducated kum reach aaganum... 💞.... #loveislove
None-of-the-above,Really great 👌👌👌👌
Hope-Speech,Good job 👍👍👍 I am proud of you bro's
None-of-the-above,"You guys killed a classic to fit in that Greek tragedy like ambience. Varun should have been alive to speak, to speak aloud and to exist like anyone else should."
None-of-the-above,Stupid  y ur saying wrong concept
Hope-Speech,I accept love to love you
Homophobic,If we are doing anything against nature....it will be a disastrous for us
None-of-the-above,Anchor voice.... Sounds like... Paridhabangal.... Sudhaagar😃😃😃
None-of-the-above,"Hai, I'm Ajay. Really felt relaxed watching this movie. I missed these brave move. My partner not strong to be in public. Now he married a girl and happy. I was also happy. Bcoz I loved him. Atleast watching this kind of movie making me feel relaxed. I'm still living with his memories. And so many happiness in tiktok couples. Thank you director for this movie. I'm late 😊"
Hope-Speech,It's really amazing
None-of-the-above,Archana Shree what
Hope-Speech,"I can relate my life to this movie.  I have been in a gay relationship for about 25 yrs, started when I was 16 and my partner was 13. We still go strong but we had some difficult times.... when I watched this movie I was totally able to understand the main castes' feelings. .. great movie"
None-of-the-above,"take care,be confident. No problems"
Hope-Speech,Very genuine talk ma.. Time will change everything..God bless you
None-of-the-above,She is a real human
None-of-the-above,Rekha S great explanation. if a Straight guy marries a trans.. won't that make the guy..  homie..! kudos.. idc.. no hatred. spread luv. bubye.
None-of-the-above,She is beautiful...
None-of-the-above,"Is going against nature right? Destroy the nature who is going to suffer? In the same way this law will show its bad impact very soon,  people who are bound to family and culture keep your children safe  teach them the value of nature from the childhood because the future is going to be worst because of lgbt freedom"
None-of-the-above,Thanks a lot...
Hope-Speech,Excellent acting nanbha 😍🤗😍
None-of-the-above,Part 2 next year....
None-of-the-above,no bro it's the very big problem for me
Counter-speech,Why is it wrong to be a homosexual. Nature is what also decided people to be homosexual. So please accept them as well
Hope-Speech,Mee to friend
None-of-the-above,Nice to see clarity from people.
None-of-the-above,Nothing every one can take their own Decision when there is no harm to others
None-of-the-above,I want heart from tmp
None-of-the-above,She is so pretty
None-of-the-above,Man ur so so so so cute man love man. U reminds me of my lost friend. I respect u a lots🤗🤗🤗🤗🤗🤗🤗
None-of-the-above,"Heart touching film, my most fav also.."
Counter-speech,Helping poor people is super
None-of-the-above,Today only I watch this .....actually it is birthday defect...and not at all parents or their mistake....I too watch one person...she is actually my friend
None-of-the-above,there r sleeping
None-of-the-above,wonderful movie......this is real many persons life this situation only but they won't accept..
None-of-the-above,Hi friend where are you from
None-of-the-above,So many are commenting she is not looking like transgender she is like girl... why she shouldn’t look like transgender.. why should they try to look like typical girl instead of being themselves.. this really shows we are not accepting them the way they are😔
Hope-Speech,U guys must be appreciated for this social exxperiment prank; Well done guyss; U will reach heights....❤️
None-of-the-above,Hi Vignesh. don't feel.our community people are here.if you have any support  contact him.
Hope-Speech,Am manly gay 💪🏼.. m proud of myself .. my was try told my parents ..but am said my parents m don't hv feeling girls  . M feeling sisters r mom .. they are didn't understand what am say ..m confident m gay love myself ..dontr care anyone
Hope-Speech,Bright future Acting vere Mari
None-of-the-above,I met her Nerla kudi she is so sweet only rombha soft n kind person
None-of-the-above,Hats off you
None-of-the-above,Looks like a good lady  must be a wise worldly lady very bold and informative lady ; Lets encourage them to lead a normal life
None-of-the-above,Sneha Solomon why
Hope-Speech,"I really cried while watching this video,  They also should be treated like human beings. May God bless all of them! Love from Sri Lanka ❤️❤️😘😘"
None-of-the-above,Is this crct for u and ur partner?
None-of-the-above,"Hi...I'm from Kerala, plz talk abt KALLADA Travels issue, staffa worse behavior..plz make every one understand about that travels..I'm not in Instagram or Facebook to follow or message u but plz take tiz comment seriously.. plzzzzzzzz"
None-of-the-above,Harish's Father...You nailed it uncle...legendary acting...So awesome concept & acting ...wish you all the best to the entire team....
Hope-Speech,Don't worry everything will be solved soon
None-of-the-above,Ur really great akka 😍♥️🥰💜
None-of-the-above,Its not upon to birth
None-of-the-above,"For this video, i subscribed your channel. I thank you for showing the true colors of human. Thank you da nanba♡"
None-of-the-above,Krish krish  yes but he is not rply for me
None-of-the-above,Nice story and nice characters
None-of-the-above,"Bala kumar ji correct ah solreenga..; nowadays whatever new thing comes, most of dem say its social changes & evolution.. ; And those who support dis dont follow changes but jus for sake dat dey want to show dat dey r  broadminded they support t blindly without thinking abt future generation.."
None-of-the-above,My  number  WhatsApp number call me please
None-of-the-above,Bro one small change ; it is not article 377 it's a section 377.. there is difference... But clearly explained thank you.
None-of-the-above,"Plz tell it clearly,  don't show all ur tantrum...."
None-of-the-above,Super brother ❤️
None-of-the-above,Really 👏great  hattoffs
None-of-the-above,I will get blessings from that Good soul.
None-of-the-above,You are right bro...👍👍👍
Counter-speech,Transgender many people good only
None-of-the-above,hi Nice Speech Malini We All  Respect & Support U. be like this  Always with brave
None-of-the-above,Stfu don't act cool
None-of-the-above,Latif guy told... can i hug you one for last time... nu sollumpothu my point of u full heart damaged persons sure started cryed.... director hatsoff u intha point la nenga highlight... and latif ur talking that emotion unbelivable congrats ur acting brilliant
None-of-the-above,Really superr bro sister💯💯
None-of-the-above,Katrina face is so calm and innocent ... but brave too
None-of-the-above,hide of world Sujith e-mail address krishnan00dlfgmail.com if you have anything else messages me
Hope-Speech,Rompa you tube channel  parthurukean ana nenga vera 11 bro .... Keep it up..... Keep always sai blessed ....🙏🙏🙏🙏
Homophobic,It's about what we see and what we feel.But according to me it's a sin bro
None-of-the-above,I agree bro❤
None-of-the-above,Am not convincing
Hope-Speech,Heart touching broo...
Hope-Speech,Visuvanathan swamynathan  sure we should not depend on others if we are independent none will touch us or will not able to talk anything towards us 🙂
None-of-the-above,"It's good , I'm agree that Court order; This is part of generation in next level,"
None-of-the-above,She is so beautiful and cute
None-of-the-above,Vijay Sethupathi dubbed voice superb..
None-of-the-above,I am also waiting for you!
Counter-speech,Such a good video creating awareness is more than anything
Counter-speech,Giving birth alone is not a life .u should live a life with whom u love .that is the real meaning of marriage .by the way homosexual marriage is much better the business marriage ( giving varadachinai) life is short .so live a life on your own .some people say how would u live when u become old  wait guys ! Life is not gurenteed .no one can say when we will die .so are up suppose to believe and
None-of-the-above,Wow...she is so beautiful
None-of-the-above,"Congrats team ,great effort my best wishes 😍👍👍❤🌈👬🏼"
None-of-the-above,No chance 👌👌👌👍
None-of-the-above,It is acceptable in our culture
Counter-speech,"why is it not right? Love is love. Everyone must have the right to live whoever they want, irregardless of race or gender."
Homophobic,"Nice movie but  India not possible gay relationship, marriage, maximum gay people looking  sex ,money, not love I have experience, my age 31 then my life and healthy total destroy I am 4 times suicide not death, present only living, friends plz don't destroy ur life  be safe health and life 🙏🙏🙏"
None-of-the-above,boss ur age
Counter-speech,really heart touching 😢😢😢
None-of-the-above,They should have informed the police
None-of-the-above,Yacoob Mohamed agree
None-of-the-above,She's so cute
None-of-the-above,Sanjay Ludo sorry brother.
None-of-the-above,"Royal Queen  You wanna know how ppl ruled the world..Its bcoz of women,money and liquor and ..Men weaknesses are women,money and liquor.They didn't make women slaves.They made men slaves.Women were raped."
None-of-the-above,I am very glad that I did my documentation on transgenders....looking forward for more reforms by government and society...
Hope-Speech,Wooow good to see lot of positive comments and many people atleast now understand and respect their feelings.... 😃
None-of-the-above,"Okay. Finally simple  people is like that. change them if possible. If you don't , then won't blame them. Not only the Quran even Bible says to women to cover their Hair . Every Religion merely talk about it. I m not here to talking for women . I don't care about you . If you want to be in this side or that side , I m okay with that.Men always have the advantage of being what we are. I don't care about the women stuffs .You girls want to sleep with lot of guys ??? Even myself also very much interested . Go and whatever wants to do . Every actions has it's side effects. Don't put the blames on Men for the mistakes you committed"
None-of-the-above,"Perumal,watch this video with ur family,later we comment abt ur statement"
None-of-the-above,Bru talk about India Sri Lanka relation bcz most of the people were fighting regarding ths
None-of-the-above,moorthi moorthi really you are good
None-of-the-above,IF LORD SHIVA AND LORD KRISHNA CAN HAVE SEXUAL RELATIONSHIP AND GET A BABY WHY CAN'T HOMOSEXUALITY BE LEGAL IN INDIA
None-of-the-above,I accept that you are a lesbian.but the body language and the way you given answers to the question is like a rowdi.. Change your attitude it might help you in future..
Hope-Speech,😇❤️❤️❤️❤️😇 very  very very nice part 2 withing😍👌👌👌👌👌👌👌👌
None-of-the-above,Bro don't play others feeling broo
None-of-the-above,Really great job 👍
None-of-the-above,super bro speaking genuine
None-of-the-above,Talented girl but she is wrong motivated to youth
None-of-the-above,Nice speech and exp.. It's their freedom and interest it's not good to restrict them
None-of-the-above,Bro waiting for fun
None-of-the-above,"My opinion :; Judgement is useless,unwanted"
None-of-the-above,This is not prank emotion
Homophobic,I thing modi and amhrisha going to do hemosex marriage
None-of-the-above,she is actually like girl
None-of-the-above,Be make a video about Pilot and Pilot training
Hope-Speech,Very super anna
None-of-the-above,"Only by ur content i know that she was transgender, otherwise no can't find she was...and why the hell u post as she was...."
None-of-the-above,Bro please talk about rajinikanth....and his life
Hope-Speech,Visuvanathan swamynathan  thanks Viswanathan everything is in our hand we should be confident in what we are doing what ever u said I too faced everything in life but now a better person in society my kind advice never ever depend on others then nice chatting with you 😊
None-of-the-above,Not everyone is lgbt!!
Homophobic,"Though I don't support same sex marriages , I support transgender rights & naturalism (nudity included). There's a famous quote by a female non English European nudist- ; NUDISTS HAVE NO PROBLEM BEFRIENDING PEOPLE WHO ARE DRESSED BUT ITS NOT VICE VERSA. 😂. FYI, ANCIENT CIVILIZATIONS WERE WAY MORE MODERNISED THAN PRESENT UNIVERSE."
None-of-the-above,its not western culture🤣🤣🤣🤣
Counter-speech,"First of all thanks for sharing,; 3:52, bro gender fluid is different bisexual is different , bisexual- Sexual orientation; Gender fluid - Gender identity ; Sex ,sexuality and gender are  different.;  Good supportive video for minority community....Thanks for sharing ....kudos bro...."
Hope-Speech,"When she hugged him , I got tears in my eyes 🥺🥺"
None-of-the-above,just waiting for someday to come in my life like this!!; awesome acting by both of them!!!....good work mr.mani shankar...
Homophobic,Because of society?? Then the problem is with us because we are part of the society.
None-of-the-above,I think she acted in Nandhini serial. Ep 186
None-of-the-above,I need gay sex partners in cuddalore...interested persons plz msg me..
Hope-Speech,You are very bold.... But I am not like u(bold as you)....so my parents are not supportive.... Some of my friends discouraged me.... I want to be myself.... But I can't.... I don't know why....? Thank you for your video it's motivational and essential.... Thank you; I am proud to be(a gay) in LGBT community....; Thank you so much.....😊; Be happy Stay safe and Spread love.... Bye....😁
Hope-Speech,"Beautiful movie 😍✨❤ very close to real life incidents.  No nudity, no sex,  neatly shown. All the characters have done great job!! Especially mother's role, was heart touching. I loved it. An excellent message conveyed through this movie.There is an equal responsibility of both coming out guys and parents to   understand and accept the facts. Kids should convince parents in any way as parents deserve to know the real us. Also parents should understand and love the kids for however and whatever they are."
None-of-the-above,Good eye opener. Very crisp and clear delivery of thoughts. Keep going.👍👍❤️❤️
Hope-Speech,Best movie and people not understand relationship feeling I miss my life
None-of-the-above,I've been looking for this piece of art for a long time. Thank you
None-of-the-above,Don't spread fake facts.
None-of-the-above,"And I never told a woman like  Hey you will marry one man .If you want to have sex with so many men , I don't have any issues about that. What I m saying is , Just take my contact number also"
None-of-the-above,Seriously heart touching video ❤️
None-of-the-above,Sema mass first class outstanding explaination   like and love u super smile very nicenga
None-of-the-above,"Nice writing , anyways i love karthick kumar.... Ha ha just kidding awesome one."
None-of-the-above,Sister... Vere level🔥 Wishing you all success in life🙏🏻🎉
Counter-speech,Puruchutha puriyanum avlotha don't judge others good job bro sema.....
None-of-the-above,Great. Simply Excellent. It is very clear Director Mani has deep commitment and involvement in his projects. He is a brilliant diector and can make a great impact in film industry. The subject he has touched is bold and timely. Indira Iyer
Hope-Speech,We didn’t expect everything to change overnight.. but so heartening to see so many people accepting it; ; Vikatan thanks for it ..again proved you are above and  beyond all .. when it comes to Tamil magazine..; ; I am proud as I am 🏳️‍🌈. And proud Tamilian too..
None-of-the-above,"no love many times I am watching video Good friendship only understand guy life, but all are fake. Friend"
Homophobic,Think about one generation where no male wants to live with female and no female wants to live with male. It will be the end of the humans. Male to male should not be attracted for sexual desires. they can be friends. people think this as freedom but this is not. Don't consider transgender as lesbians or gays. They change their sex and then they are attracted to opposite sex. Don't think that whatever foreign countries do as correct. We were the people who were leading culturally. they should follow us not the reverse.
None-of-the-above,congratz bro for 90k subscribers cheers
None-of-the-above,Very nice tq so much for this video
Homophobic,Its not good 👆👎👎👎👎👎👎👎😏😑😣
Hope-Speech,Hey heart melting ya😥😥
None-of-the-above,Bro iam share 10members
None-of-the-above,good story. good acting. but really is it possible? lathif acting is really good. all the best
Counter-speech,"Sheik Dawood Where's the concept of a wife in a gay relationship?. And, it's totally suitable for all environments. Coz, it's human and natural. And, it's not a culture. It's a sexual orientation. No one becomes a gay, and no one can be forced to become gay. It's all inborn."
Counter-speech,Im cried😭😭😓.Respect All members❣️❣️❣️.hats off bro🙌🙌👏TMP❣️❣️love u bro .part 2 waiting bro🔥
None-of-the-above,Can you pls give the mic to homosexual ppl and ask how they feel ?? Will the camera turn tat side as well ???
None-of-the-above,Pubg player pola winner winner chicken dinner🤗🤥
None-of-the-above,"I am a openly gay Indian, this movie brought tears and joy to my heart, the empathy from the father is what we expect from our parents. Beautifully choregraphed film and the most important film I have seen in recent history of Indian Cinema. thanks a lot to the entire movie team."
None-of-the-above,Your look s cut
Homophobic,loh jen# its not a natural habit it is influenced by others.. mostly childrens are seduced by homosexuals
None-of-the-above,This girl lives in 2050
None-of-the-above,So what abt.it???🥴
Homophobic,Any btm sucker?
None-of-the-above,Hai bro.. Nice speech..... Congratlation for ur great thoughts..
None-of-the-above,I would never say this is prank .. this is a gud video of awareness.. kudos guys
None-of-the-above,Many of these words are in English. But the words use to scold woman demoralize them sexually. This comes because of the concept Karpu which men are not related to it.
None-of-the-above,my number
None-of-the-above,The comment section is filled with humanity than the video itself <3
None-of-the-above,Wat was tat
Hope-Speech,"Shrinivasan Kannan  societies what society we r the society so I accept that relationship ,,,,when you will change some time ,,,,,so society will accept lesbian gay bisexual transgender"
None-of-the-above,Bro Tell about mayan calender
None-of-the-above,Can't u just mention actress Katrina?! Are u mentioning Lady actress so and so while interviewing others? F**k the TRP.
None-of-the-above,Keerthana Jayavel very well done
Counter-speech,if you are blaming them...then first blame your jesus for creating such natural changes..
None-of-the-above,"I stumbled across this movie by chance. What a work it is!! Simply the best.. ; The story line, the actors and their acting all are in the perfect frame. Really made my day. Thanks for this classic work 😇😇😇😇"
None-of-the-above,May I know these cast's any other movie? I surely can watch it...
None-of-the-above,I am also like a latif.....; But my partner leave away from me
None-of-the-above,Makeup by Yesu  🙏🙏🙏💕💕💕🤗💐💐💐
Hope-Speech,It's realistic 🥰💯
None-of-the-above,Bro u name and phone number (or)mobile number please kotuinga
Hope-Speech,👌👌👌👌👌👌👌👌👌👌👌👌👌👌👌👌👌👌👌👌👌👌.   IAM waiting part 2
Hope-Speech,If any couples in real life in this society?; Really it's amazing story and love; Hats off to lathif character
Hope-Speech,Anna Super 👍✨😂😂; TMP Anna's you consept super👍;  My heart feeling 😭😭😭 ; Thirunankai is real life human being 👍
Counter-speech,Awesome....😎 everyone should respect them...
None-of-the-above,Very nicy Love
None-of-the-above,I  love this movie
None-of-the-above,I respect those souls ...who fight for their life and not beggijg in train and other things !!!!
None-of-the-above,Blod speech.. Salute u sis..
None-of-the-above,I live latifs innocent face as me!!!
Homophobic,People's Need to know about LGBT sex .... I think its not wrong
Hope-Speech,Plz upload part 2 soon
None-of-the-above,Lathif acting good
None-of-the-above,Kaviya see u dnt need to understand ....You have ur world where u   have difffrent feelings which cant be understood by LGBT ...The same like u ...Just acccept it like everything is love
Counter-speech,She is a pure soul
None-of-the-above,Thanks for choosing this topic 🤝
None-of-the-above,Hats off. Ur so bold.
None-of-the-above,Naa Kanda theivam.........thiru......en Akka
Hope-Speech,It is nice n needed one 🙏and I wish you 🤝🤝all to Come up with many more useful content to this society bro.. 👏👏
None-of-the-above,Dhinesh Kumar Kandasamy  he told most . Not all ppl are LGBT .
None-of-the-above,Amen Glory to Lord Jesus Christ
Counter-speech,Please  guys.. Respect our feelings!!   ; Well speech  Malini.. I'm From Malaysia!!  Please do email me!!
Homophobic,This is why I hate chennai shit
None-of-the-above,This is not first time... Vada with saarithiran already did before. But this is awesome video 👍🤗❤
Hope-Speech,Respect for you akka
Hope-Speech,god bless you brother
None-of-the-above,Yes. we  think in citizen movie..not sure though..
Hope-Speech,I too love a guy and even he loves me....
Hope-Speech,U r very clean talker... Body for mud... Only heart will see god...
Hope-Speech,She is very caring type bro 💯
None-of-the-above,hmmmm love is the most powerful weapon that people used to do sins :); Dante:- worlds greatest sins has been committed in the name of love; ... one day love will be destroyed in the name of love itself...
Counter-speech,Really  😭😭😭😭😭😭😭😭
Counter-speech,I think people need to be educated well..... Even my mom supports homosexuality and their rights.... We are in no place to judge them...... I think people are being ridiculous by judging others.....
None-of-the-above,Please can anyone tell me which is that beach? It's really phenomenal
Hope-Speech,Bro vera level hats off
None-of-the-above,"Awesome story director sir, I just cried,  let all the parents understand this feeling"
None-of-the-above,I loved her soo much 😘😘😘😘
Hope-Speech,Respect for u akka... 🙏
Hope-Speech,Bro super acting
None-of-the-above,Really is she transgender?? She is so cute.. having beautiful smile ..
Hope-Speech,subscribed panniyachii. Bro.; ; ; ; Part. 2.  Waiting thalaivaaaa
Counter-speech,Don't use bad words on social media
None-of-the-above,She behaves and even smiles like a beautiful women😻😻and she is innocent too
None-of-the-above,Good to c charity food for needy pupils
None-of-the-above,Pisasu Lucifer attacked that persons
Counter-speech,Each and everyone in this world have their own freedom .. We don't have the rights to judge who they r . And 20 % of the ppl r only homosexual so I don't think this small percentage can be against the law of nature ...
Counter-speech,Really ill cry 😭; Awesome prank channel rise up to next level 😍🥰
None-of-the-above,They are bisexual people's they are not gays
None-of-the-above,Stop making these kind of nonsense
None-of-the-above,Bookmark this and read after a decade. You will understand the problem which it's gonna cause
None-of-the-above,SUPERSTAR VIJAY s she's
Counter-speech,"Don't wry Varun. Whatever happens, don't hide your character to anyone. LGBT it's not about sex, its about hormones. Just convince them at right time. Time will change everything. And we are different character only, not a shameful character. Right !!! We don't rape anyone, we don't cheat anyone, we don't do any crime. So, be proud and brave to show ur real. Lots of loves ❣️❣️❣️"
None-of-the-above,She is very good love u sister 😘
None-of-the-above,Super bro romba feel and waiting⏳
None-of-the-above,She looks like Nayanthara in her younger days
Counter-speech,"Shrinivasan Kannan  newsflash! No psychiatric association says it's a disease!! First learn science, then comment about asking me to go to recovery! productivity?? One among the greatest artist, anatomist, and physicist of all time is gay! name - Leonardo da Vinci! Do I have to tell more examples? Or ur point of productivity is just breeding?? And the previous law (377) was actually about sex between consensual adults in private. Did u know that? Did u know how many gay couples were blackmailed fr that??"
None-of-the-above,Very good. All the best
None-of-the-above,"Kudos to Malini for this very 'matter of fact' interview. Her voice reverberates courage. This interview addresses most of the cliched questions, LGBTIQ community is asked, hence everyone should watch it - please could you add sub-titles if you can. I adore you Malini for your courage! Well done Nakkeeran for taking a step towards asking the questions. I would appreciate, like Malini said, if you could direct your efforts towards highlighting the issues faced by the LGBTIQ community, hence be the positive change agent, as you always have been."
