category,text
None-of-the-above,Wow;  smooth story ; Topic very clear ; Awesome performance and couple s; I love it ; Amazing reaction ; Ultimated by act and dialogue ; Nice to team work ; Best act latif; Unbelievable of story line ; Best one again Beautiful ; Vera level ; Marana Mass ; Thanks for Director  Mani ; Totally 99.9/100
Counter-speech,"Even I am straight I support this, we have to treat all as humans"
Homophobic,"anu lavanya  also I will give u an example that there are people who likely to theft which they found to be different even though they are rich and can buy.. its their disease, this should be treated with proper counseling.. not to be encouraged.. and on what basis you are saying this is natural.. even though there is no proper proof.. this is something spreaded between people's and we educated are going with others words..."
None-of-the-above,latif actin was prof' ..... great story and acting
None-of-the-above,Already supreme court has banned 🚫 one TV news channel in Mumbai for talking negatively about LGBT community people.
None-of-the-above,Getting True Love person is difficult 😞
Hope-Speech,Really super broo
None-of-the-above,Cool Bans   yaaa.. I will accept.. even I done tat.. what's the big deal..
None-of-the-above,Hooow sweet 😭 when Latif called Harish 'darling' & when Harish called 'i love you' both moments were so sweet for me.. Give me a little bit of smile.....i also want to get a partner like him❤️
None-of-the-above,Bro plz explain  about Egyptian culturs how  they  lived  all plz 😃😃😃😉😉😃😃😁😁
None-of-the-above,Y any thing wrong in gay
None-of-the-above,But does hindhuism really forbid homosexuality ? I feel like it’s more Our society that hides behind the religion to covey their own opinions ? I feel like Hinduism is really inclusive.
None-of-the-above,Good madam.if i get any oppertunity in future i will give help some transgender.
None-of-the-above,Please watch  evening shadows   on  Netflix  .a gay love story. 😍😍
None-of-the-above,Yaru lusu I won't understand her feelings unless or until u face it
None-of-the-above,I am waiting for 2nd part nanba
None-of-the-above,I'm straight but I can accept her words...
None-of-the-above,India doesn't consider gay sex as a crime any more. Please change that.; 🏳️‍🌈❤️
Counter-speech,"She is not.! She is asking for the right (or freedom, if thats what you call) to be her, as your 1st line it self. She is asking  you to not worry about her sexuality, actually anybody's sexuality."
Hope-Speech,Super video... Sis Very nice & kind hearted. 😁 😘
None-of-the-above,Touch from heart bro
None-of-the-above,Yow sema yaa... Heart touching 💖
None-of-the-above,Wen u dnt put an intimate scenes it actually reflcts lack of chemistry between the actors...
None-of-the-above,thank you Anna video
Hope-Speech,Don't feel dear  God bless you
None-of-the-above,Waste of time
None-of-the-above,Really true best of luck for your future
None-of-the-above,"Hamelton Melvin   thank you so much dude.and in comming your future,you will get long happy live and full enjoyment. Keep going.you are a  good person.so congratulations for your happy life."
None-of-the-above,Heart touching  it's not a prank such a good motivational video guys  suportive video
None-of-the-above,Such a wonderful very emotional film.everyone should openup their feeling. All actors are great in this film
None-of-the-above,Tq you so much for this film
None-of-the-above,Super bro new thinking make your success keep rocking then the acter of this prank has a great future vera level
None-of-the-above,Woman is a beautiful creation on earth...which will look good for any one..love u katrina...
Hope-Speech,Super bro i it's my inspection
None-of-the-above,S really she is so cute
Homophobic,You father is getting by homosexual then how to you born in the world. Your speech was not justice for human being very talented. So your homosexual thinking created and developed by yourself and by your living situation. That's your problem so don't criticize to anybody for this issues. Peoples be allotted and keep to distance of this type of guys I advise to all the peoples especially for young generations. This is our culturally very bad and worst activities and God's is not creating this type of homosexual man's and lespian woman's.
None-of-the-above,What a beautiful mind they Have...... 😘
Homophobic,Hormonal and psychological problem!!! Nothing more nothing less !!! Don't bring nature here and make it dirty !!!
Homophobic,Positive and positive should not and won't attract that's what the thory of nature
None-of-the-above,Factu; I accept and agree
None-of-the-above,Super bro I am transgender so I proved of my gender thankyou thambi
Hope-Speech,Malini sis 😎 everytime u speak u proves that u r a human with humanity respect;  ✊ 🌈 ❤️ is ❤️ - ; avoid hate comments those who comment hate comments are the next murders of a beautiful soul ( meant will be a reason for homosexual persons suicide if they find one in their family)
None-of-the-above,"At 0:03 he says that it is untouchable crime , but how can he say that !!! They are also human !!!"
None-of-the-above,She looks so cute and adorable super ma chellam
Hope-Speech,Amma. ..God for us
Hope-Speech,"Ishvar Mahendiran Sir I am not from India but I can understand Tamil, I am not sure why we should discriminate someone just because we don't understand them, I just want to give moral support , I don't see anything wrong in it🙏"
Counter-speech,Hats off jiii
None-of-the-above,Bro back round edited a really a
None-of-the-above,Acting good bro
None-of-the-above,Come fast ok what app
None-of-the-above,Haha she is so cute and innocent
Hope-Speech,Script super ra thambi
Hope-Speech,Don't worry mam we are with u love u
None-of-the-above,Harish PREM SANKAR; Latif     KAMAAL LENIN
None-of-the-above,Subscribed only for VJ ashiq
None-of-the-above,I  pity for u r son mam
Homophobic,God created Adam & Eve ....; Not Adam & Steve...
None-of-the-above,"Every human being has spark in them. Educate, set a goal and try to become a entrepreneur. Just try."
Hope-Speech,Thank u director sir.... I really proud LGPTQ
None-of-the-above,Good point.. but it's not about love it's about sexual orientation. These two r totally unrelevant
None-of-the-above,Wowww...so much pain in ur voice..what a powerful communicator!
None-of-the-above,stepping out of ur comfort zone tis is the real success bro👏#frank talk make more bold videos bro😊
None-of-the-above,Pavithra DM LGBT means
None-of-the-above,I have seen already in other interview about her love story and lives of transgender
None-of-the-above,Wait for some days.. It's gonna be changed..
None-of-the-above,I'm totally confused can you please help me to come out from this feel
Counter-speech,She is so kind and good
None-of-the-above,That guy in white shirt is horrible
Hope-Speech,I am. taken back to my life. the. movie end with a. good tone..but my life. still in. the pain mode.... i am the latif in real life. ....but. my. harish. ..is. gone away from m...still long for him..
Homophobic,World will end soon
Counter-speech,Are u sure it's been medically proved?? Because I'm an mbbs student my books clearly say it's not a disease or increased sexual desires.
Counter-speech,Life teaches big lesson ....for some peoples ....#obeytrans
Counter-speech,Dei you guys are making fun of gay people 😂 but in reality all of you guys look like gay orgies! 🤦🤦🤦🤦🤦 Thirunthungada 🤣
Hope-Speech,Waiting for second part
None-of-the-above,sowmya narayan  ofcourse v do
None-of-the-above,Mani Shankar Iyer actually I must say.. Pleasure sir
None-of-the-above,Murali Kumar homosexuality is not a influence it's an Intrest  and a natural habit
Hope-Speech,Super Vera level ....thambi👍 I am waiting part 2
Counter-speech,"Love is Love. And Everyone should be able to Marry their loved one irrespective of their gender, under consent, without any regret. Genuine loving people are affected by poor close-minded people's laws. ; 1st - India already had Homosexuality in their Culture! ; 2nd - British came, ruled us and made the section 377 to ban Gay sex (which obviously means - some Indians were gay at that time) ; 3rd - British went back and Normalized Gay love and legalized Gay Marriage. Here we are still holding on to their colonial era law and stigma around that they left behind, as like English language. Time is High to revive a Basic Human Right to Love, and our Indian culture which also includes in itself, LGBT community. ; ; P.S: You don't have to be Gay/lesbian to voice out for LGBTQ rights! just the way, You don't have to be a Woman to support/voice out for Women's rights"
Homophobic,It's totally wrong. Foreign cultures is different from our culture. So a men is to a woman . This is a Sin
None-of-the-above,Total West India is the best country best of the judgement Chile judgement men is the men woman is a woman is not different judge wife is the man what are the Chile judgement waste waste waste totally waste India is back on back side go back  he is not good
None-of-the-above,Love is beyond sex and gender. All human being should realise
None-of-the-above,Malini I love your words and thoughts
None-of-the-above,Sema acting bro
Hope-Speech,"Kadhayalla Nijam  yeah bro. Lord is the source  for happiness, peace and love. Lord jesus christ always loved people, who believe in him. ; ; Lord jesus christ loves gay people because God  is the father of his own children"
None-of-the-above,Bro speak about Bloody Mary does it exist
None-of-the-above,Want .... what you want  .... ❤
Hope-Speech,Good awareness movie
Hope-Speech,"Hey nice interview. He spoke very naturally... But don't change like girl... Because your born was boy like body... Your voice and everything but Ur heart is like girl it doesn't matter ... U not a thired gender..... U r a male.... U have ability... U have confidence this speech very naturally... Nowadays all transgender has brave, confident strength and knowledge, so proof urself.... All the goodness comes automatically......"
None-of-the-above,Good acting  keep rocking Bro 😘
None-of-the-above,BONDA vaayan with beautiful girl... I 🤣🤣😀
None-of-the-above,Bro do video on The History of Rose (Roja). 😍🌹
None-of-the-above,Latif father is so lovely
None-of-the-above,Excellent speech you are great bro
Hope-Speech,Super brother hand's of u
None-of-the-above,"your knowledge is good ,and ur wake of presenting is clear😄😇pls don't revel any mistake in words ,that's change the meaning of ur talk"
None-of-the-above,"Hi Team,; I do have a story , Want to make it in the big screen.If any one interested please discuss. Definitely will like it."
None-of-the-above,She looks so beautiful 😊 nice interview😊 respect these like people👏👏
None-of-the-above,I am addicted in you videos; Last few days  am watch 80 v; MECHANICAL engineer
Counter-speech,is the whole point of life only to procreate?? stop talking about culture all the time..who created culture. who are you to decide whats right and wrong? they are not harming anyone...they are just demanding to let them live peacefully...LIVE AND LET LIVE...dont decide how someone should live their life
None-of-the-above,She is more beautiful. No one will find  she is trans without her voice
None-of-the-above,ஐயோ over da ...; You should know the scientific reason behind iT.
None-of-the-above,Congrats to Vikkimedia and full Team of the movie
None-of-the-above,Hi bro nice want to c u
Hope-Speech,Acting vera lvl
None-of-the-above,Awesome real 1..gud try..🙂
None-of-the-above,Well done. Good try to support the frds..... Let's all respect.we  are also human.
None-of-the-above,Romba natural acting ...awesome ...every one acted well
None-of-the-above,Same this was my mind voice
None-of-the-above,Its not others duty to look what the hell others carrying inside thier phants. You guys have many other works go and do that .
Hope-Speech,Tmp first channel only did transgender prank really  heart touching👌
None-of-the-above,Gayathri Krishnan. Ellen degeneres theryuma?it's not a choice ...it's a condition
None-of-the-above,Who all waiting for part-2
Counter-speech,sowmya narayan  nothing wrong..you live your own life.. let them too love their own life.. nothing is wrong
None-of-the-above,Super super romboooo 💯💯
None-of-the-above,Nice movei hats off to logesh sir thanks for this movei
None-of-the-above,"do you even know what section 377 is? I suppose not, do everyone a favour and Google it."
Hope-Speech,Your Act is awesome 👏👏👏
None-of-the-above,Mohammed Arshad  bro 🤔 un dp photo 😂 super
None-of-the-above,all are having a sense and vary from each others. if like accept. do not force and vialence any one.
None-of-the-above,Cod bless you malini
None-of-the-above,No one will tell she is transgender unless we hear her voice
None-of-the-above,Sathish Shaj  thank you
None-of-the-above,Babu G  ; Your number please
None-of-the-above,She's look so so so beautiful
Counter-speech,Police have to punish these type of people. Don't give up sympathy to like this
None-of-the-above,Yappa  daiiii.....I didn't  even think about it.....
None-of-the-above,Paavam Rompa Nalla Akka.I Really Proud of you.
None-of-the-above,bible is unscientific. proven in Supreme Court of India
None-of-the-above,Panneer Selvam  hi bro thanks
Homophobic,Get lost..... This is against the rules of every religion.... This homosexuality stuff is against the rules of GOD...... GOD'S wrath will hail upon them... BEWARE... BEWARE.... BEWARE.... #GETBACKSECTION377..... #SAYNOTOHOMOSEXUALITY.....
Hope-Speech,Waiting for part 2
None-of-the-above,Latif    :    KAMAAL; Harish :   PREM SANKAR
Counter-speech,Bro Vera level bro Neega great bro hats off no one can do this.And that akka u r so so great.While watching this my eyes filled with tears
Counter-speech,"Homosexuality is not sin. It is a natural process. It will be growing exponentially, it is nature’s way of controlling birth. It is sad that indian government is following western rules. ; In Indian mythology vali, sucreevan mother probably homosexual. She was described as ‘ man in daytime and women in the night ‘. Making the homosexual as criminal it self is a crime."
None-of-the-above,The security officer acting is amazing. Storyline great
Counter-speech,"it merely depends on your self confidence.... it is No use in living a fake life compromising your likes desires for the sake of others....there r many people in this Society who r in relationship , some r even living with the permission of parents....all that matters is what u decide and how determined u r in your relationship...."
None-of-the-above,Same same my life too dear. You can understand my feelings please make relationship with me. My WhatsApp number.  +940776407443
Homophobic,"We should not encourage this judgment,  because if u keep have ** with same gender how your family will grow..  What about children!.. Leave about the country..   God has given opportunity to live with boy and girl only in this world.. ..  Not same gender.."
None-of-the-above,Anna front and front super anna
None-of-the-above,Loga Nathan s correct
None-of-the-above,Thank you brother
None-of-the-above,I m ready to do a short film on this journer.  need producers.
None-of-the-above,I want time travel 2 and parallel universe 2 please bro
None-of-the-above,You forgot to tell Justin Bieber 😂😂😂
None-of-the-above,"U from, your age"
None-of-the-above,Malaini brother ❤️
None-of-the-above,"Santhanaraj F  the same bible says to kill people of other community, kill non virgins, legalises rape, having sex with his family members is OK,  can anyone condemn this .its all in the bible"
None-of-the-above,Is that your opinion you're describing?
None-of-the-above,K..thnks for ur comment
None-of-the-above,u r really great. but I got divorced since I am gay.
None-of-the-above,She's gorgeous 😍❣️
None-of-the-above,Amen! Glory be to God!
None-of-the-above,I reject this idea
Hope-Speech,It's A Great ♥️
Hope-Speech,Romba heart touching irukka bro
None-of-the-above,we respect...you kinda peoples
None-of-the-above,"Christianity is a illogical, impractical, truthless by a Christian"
Homophobic,Scripted waste of time
None-of-the-above,Keep going on brother don't fear for anyone
Hope-Speech,LGBT ok ..; Wat about Q
None-of-the-above,That's the same point I m trying to tell you. No men is like that. Even you told our great grand fathers had more than one wives. But I don't think so. No men will say Hey I had sex with three women last night and I want more Tonight. But so called these feminists actually they doesn't know about feminine . What they are doing is just blaming the real men
Hope-Speech,I think this is the first short film openly talking about LGBT community. I think most of the LGBT community people are very talented but they are abused by some people. they used to LGBT community people but after getting benefits threw them. after that's not breakup it's called betrayal of friendship. atleast they want some good words. but they treated LGBT community peoples are like ugly things. before getting favour they were never behaved like this. now all of u say who is wrong? either LGBT or that kind of cheated persons
None-of-the-above,This is true super 👏👏👏👏👍👍👍👭👭👭👭
None-of-the-above,she's a girl lesbian
None-of-the-above,Psychology theory is correct....
None-of-the-above,this was good great
None-of-the-above,She is beautiful
None-of-the-above,Y do Hetrosexual parents give birth to LGBT ... Do anyone have an answer...
Counter-speech,But that transgender do dance for him its just heart breaking 😪
None-of-the-above,what limits? Please elaborate.
Hope-Speech,Great concept. Love is love.
None-of-the-above,Dear Sennila thanks I worried to  hear your difficulty a lot. I am pleased to say that Shiva Pitha Shiva Parmathma Father of all Souls Jyothi form  has come to this world to destroy all injustices and establish a justice full and peaceful world. Please don't worry the world will change.
Counter-speech,"She is beautiful, an she is just a simple pure beauty"
None-of-the-above,here sex is mean sex. there sex meant a gender.
None-of-the-above,Talk about magic..please
None-of-the-above,Yarru avarru... Sami??? Avar perru yenna?? 😅😅 .... really like this part of your speech.  Super ma....
Hope-Speech,evrything is possible
None-of-the-above,Good speech 😊
Hope-Speech,My best wishes ma. May your life be blessed and may you find peace and joy
Hope-Speech,I am waiting for part 2
Counter-speech,Im tg nivetha part two pathutu answer pandren
None-of-the-above,How to get extraordinary brain power..pls put the video Anna..
None-of-the-above,"girubhakar T  Lol,you must read my statement clearly..even as a boy I dont walk at 2 am bcoz i wanna  sleep that time.."
None-of-the-above,I like your bold speech.  Very nice.
Homophobic,"Don't act too smart to prove the sin as purity... God has created us to live holy life , unless God breaks drakness from your heart and mind you will be speaking like this only.... SIN IS SIN ALWAYS WHO EVER DOES IT IN ANY CASTE, COMMUNITY & RELIGION ..."
None-of-the-above,I like brother
Hope-Speech,Heart touching love u all the best
Hope-Speech,I'm gay and I'm happy in my life and I'm living in Chennai
Hope-Speech,Bro i am waiting for part 2
None-of-the-above,#Nice Great move by South Indians😍😍
None-of-the-above,So emotional. Very good
None-of-the-above,Heart touching video❤😢
None-of-the-above,Wating for part 2
Counter-speech,"I think you're confusing sexual harrassment with equal rights. More than 1,200 people have been arrested under section 377, out of which 208 were minors. When people especially youngsters come out to their parents they send them to conversion camps or some samiyar bullshit. Section 377 may have been decriminalized but I personally think that India has a long way to go before it becomes safe and common to be a part of the LGBTQ+ community."
None-of-the-above,Soo nice ma'am TQ sooooooomuch for opening your hearts 🙏🙏🙏🙏
Hope-Speech,Great effort  great acting ; TMP
None-of-the-above,there r sex ok but how to get baby
None-of-the-above,aneesh cool dude Im nt feminist. As a man u dont need any ism to get ur rights. Im asking human rights. When its denied just cauz Im woman then it becomes women rights. I agree naa when I told woman are good. I never told that. That is wt Im saying. Woman can equally bad as man. How can u steal knowlwdge bro?  will u say we stole electricity? Humanity alone is enough to cultivate human values. Culture is fear. They are scared from getting bad names so they follow it. Why am I tagged as feminist? Im just speaking about cultural norms. Change is needed both in culture and law. law is favoring woman and culture is favoring men. Both should be changed. tat is my idea.
None-of-the-above,Hats off this movie really needed to ppl who doesn't understand homosexual
None-of-the-above,Source of thoughts Enna?
None-of-the-above,My point of view indian cultures not accept for this life... but super story
None-of-the-above,Mass performance....dude....hatts off bro
None-of-the-above,is that she start to act in any movies ? i saw her interview videos only.
Hope-Speech,Waiting for part 2
None-of-the-above,wow Lathif acting too good nd real ..
None-of-the-above,Mind a word
None-of-the-above,Really great akka
None-of-the-above,True soul amma neega❤️u deserve a great salute and hug 🤗she really made me cry🥲
None-of-the-above,Karthick Karthick bro super
None-of-the-above,"She's bold enough to be honest about her sexuality unlike some people who hide behind a mask trying to please their family. They get married for name sake, they are not being true to themselve nor to their spouse."
None-of-the-above,"WoW.... What an attitude... Became a big fan of you for your Tamil Pulamai, Cool attitude and handling a things..."
None-of-the-above,Heart touching movie....sometimes it s hard to accept...
None-of-the-above,Pray and protect yourself from people like you.
Homophobic,This is too much.. fucking railway police idiots...
None-of-the-above,I really cried bro ..❣️ 8:00 🔥..
None-of-the-above,World is end now Quran and  Bible  not allowed
None-of-the-above,Hi pvs bro iam your  subscriber bro
Hope-Speech,"Very bold to come out and talk.speechless seeing how clear what she is,who she is. Happy for you sister!"
None-of-the-above,Intercaste marriage was not and still not punishable law. But a person having sexual intercourse with the same sex was. So when a law like that is banned its good to celebrate.
None-of-the-above,raja s  not just sister or daughter. Anyone should lead their life exactly how they want to.
None-of-the-above,justu missu seriously? Our culture and religion never encourage us to talk ill about others. This is the very basic any most important of all. Now I m confuse.. again which culture u are from?
None-of-the-above,how to contact your foundation
None-of-the-above,Create a awareness of sagarmala project..
None-of-the-above,Respect from the bottom of the heart💖
None-of-the-above,Bro super bro IAM waiting
None-of-the-above,Nuhman Nathly  😁😁 thank u!
None-of-the-above,I support this
None-of-the-above,"This film doesn't have a proper ending or any message.  It feels like just bcz LGBT is hot topic, they simply made a film to get likes n views.   In fact, in some perspective this film is wrong.    By breaking up with his partner, he broke tat other guy's heart n dreams.    And by marrying a girl, he will spoil her life too, which is absolutely not acceptable.   If he does not have courage to reveal his truth, tats ok, but at least he must have courage to say NO to marriage."
None-of-the-above,Pls decent ah webseries nu solitu ponga pa....adha vittutu prank nu sollathinga
None-of-the-above,Good morning and Happy Republic Day sir
Hope-Speech,Part 2 I'm waiting
Hope-Speech,Part 2 waiting...🙏
Hope-Speech,I love transgenders ♥️cried when i see thiz video 💯.....
None-of-the-above,Awesome speech Malini...I respect your feelings..
None-of-the-above,God bless u all abundantly 😍😍
Counter-speech,where is your data coming from? In India and Afrcia has most HIV infected patients does that mean all Indians and Aftricans are LGBT?
None-of-the-above,muthu kutti ...I think it may reduce our counts
None-of-the-above,Fantastic speech.  Very open mindedly talked.
Counter-speech,"What an amazing film! Kudos to Mani and the entire crew for not just portraying the love and the sentiments of the parents so beautifully, but also showing courage to prove that 'it's just a question of love' and not about 5 ml of liquid. I hope that our so called society wakes up to the reality that we are denying a life with dignity to so many people around us, just because they are different."
Counter-speech,"Whose faults is that for a person to be born as a transgender . Why must dispised and be isolated from society .can they respected as a fellow humanbeing . instead we brag about God,Religion."
Counter-speech,It's their decision their desire  nobody has rights to order them everybody had rights to live their own life on their own way so don't interrupt them like she said their people (lesbians)not order us to live  like their lives then why should;  we?
None-of-the-above,First parents will under them karthi parents goddd so sprit them we want those like parents
None-of-the-above,valtukkal. for your vidio.. homosexuality. meaning modelity sexuality
None-of-the-above,Love you my dear friend.....
Homophobic,India won't progress
Counter-speech,Salute to TMP👍
None-of-the-above,Ur correct sister nice speech 👍
None-of-the-above,Amazing Short-film 👌👌👌❤️❤️❤️; Perfect Actors👌
