category,text
Counter-speech,"Let them free. Dont impose ur culture, moral etc over them. There are more tham 700000000 ppl in world and more than 120 crore in india. LGBTQ may not be more than 1 percentage. So my dear traditional ppl,  it wont be an   end to human race . Having a child is not the only goal of human life. I hv seen many loving,  caring couple even without child. LOVE IS EVERYTHING NOT JUST REPRODUCTION"
Hope-Speech,Akka I want to see you please. I love you akka you are good  . Please respect trans gender I pray God ☺☺☺
None-of-the-above,Vera level thala....meera Mithun hand bag explore pannuvingla
Hope-Speech,"Nice Movie !I Support Gay 's!,I Need Gay Husband in My Life."
None-of-the-above,youtuber too much .block this YouTube
None-of-the-above,Very sad but be safe and strong
None-of-the-above,dont feel mchi lets think as everything will be alright soon...
None-of-the-above,Thank you so much
None-of-the-above,Video about match fixing in cricket especially match fixing in 2000 Ind vs SA series
Counter-speech,First of all stop considering them as a torture as if you feel uncomfortable with their presence better leave that place though your words are right your way of expressing it is something irrelevant as only a few transwomen are getting a golden opportunity to get educated as well to shine well in the career they like but a huge amount of transwomen are still illiterate and uneducated and due to the lack of opportunity and lack of maturity to behave in public area such incidents are happening so kindly do not misunderstand them as they are not doing that purposely
None-of-the-above,I DEMAND A PART TWO!!
None-of-the-above,Great job and super message
Counter-speech,Where the hell you're living . Just shut your ### are you from Mars now 2020 it's a model world each and every males are wants to project their look and style and doing skin care routines that's called self-care and grooming . Finally I've some words for you DON'T JUDGE A BOOK BY IT'S COVER.(some good souls are living in the world mind it)
None-of-the-above,Transgender actress Why this tag?
None-of-the-above,Wow Clear explanation ..👏👏
None-of-the-above,Is tamil the oldest language.Please do this topic bro
Counter-speech,Super Anna hats off 🔥
Homophobic,Even animals also did not like this; But the humans??? 😝😝😝
None-of-the-above,Lack of sex education
Hope-Speech,"Great movie and it is very well taken. The music by Gautham is so very good with the right tone and emphisis. Dilip. And me thoroughly enjoyed watching it to the last minute. The time and patience withe diversity in human creations was put forth in a very positive manner, seeking the understanding and blessings of the parents..."
Homophobic,"Bible ** Leviticus 18: 22 , Romans 1: 29 to 32 get good answer"
None-of-the-above,Nice try bro super 👌
Counter-speech,Hi all I am a hetro sexual person who is  psychological counsellor I would like to inform this that this is not a disease it is a natural emotion of homosexual people and similarly there r bisexual people too don't abuse them
Counter-speech,See them as human first . Don't potray them as God. That's enough for them. Seeing them as God or some different creature is inhumane
Hope-Speech,"Wooowww.. I felt Latif's father's dialogue reflects as mine... That's what I said to my mom and friends, when they asked questions.. Now they all accepted me as I am. As mentioned in this movie, will take time for a person to accept you. But no worries, believe in yourself and be yourself.. Nowadays, society changing much better. All is well."
None-of-the-above,It's a acting not a prank!
None-of-the-above,Also I am crying 😢😭😭
None-of-the-above,"WOW what an amazing film, so moving, already a very difficult situation to come out to your parents in a liberal country like the UK, I can't even begin to imagine the pain these guys would have felt. An important LGBT subject covered very well. Thank you"
None-of-the-above,Keerthu u r correct but i don't like
None-of-the-above,This should be strictly prohibit..
None-of-the-above,Ajmath Nisha Anarbasha  Wrong. They are not women. They have their own identity. And it's not a divide or separation.
Hope-Speech,Oscar  level  acting prank ...tributes to transgender.
None-of-the-above,Super new one
None-of-the-above,Superb bold interview.. her attitude is so good.. she just gave a clear cut explanation on LGBT.
None-of-the-above,I want saw your parents bio..and your 12th mark ..full name madan Gowri aa..Gowri yaru...marriage eppo..
Homophobic,Against of natural
None-of-the-above,This location name bro
Hope-Speech,Superb bro. All the best for your upcoming success.  Thanks for creating awareness about LGBTQ. I really don't know about it.
None-of-the-above,"Akka very cute ,❤️"
Counter-speech,Love is love at any form...they got freedom to do or be what they feel... respect their feelings.... Ignore those intolerance dumbfuck dimwits...
None-of-the-above,but truely guy no Tamilnadu
None-of-the-above,"please, bro, talk about pedophile"
None-of-the-above,How long shud I wait for u my dear bestie..??
None-of-the-above,I am also waiting
None-of-the-above,Thanks to Santhosh ; For the Wonderful Film ; No Word to say ; You have more success ; Congrats Bro; 👍👍👍👍👍👍👌👌👌
Counter-speech,m.v.rajesh kumar Kumar you are relating sexuality and sexual abuse ... both are two different things..
None-of-the-above,Great teaching  madam
None-of-the-above,5:14 the way she winked😍
None-of-the-above,It's realy good prank aluthuden
Homophobic,"Hello Bro, I'm glad someone is frankly talking about this topic..  just like you said that each group of people have their own perspective about homosexuality .. Scientists, Religious or Psychologists.. our astrologers also have their perspective.. they have said that Sarpa Dosham could be the reason for homosexuality.. Sarpa Dosham is basically a defect in one's DNA structure.. a structure that is not geometrically correct with how it actually supposed to be. Cosmic laws and the cosmic creation is above everything.. anything that's not aligned with the creation is seen as a defect. ; So my perspective is also the same.. I see homosexuality as defect in one's body.. something that nature would never accept. There are some people who like to have sex with animals and would go to an extent to even marry an animal.. does nature accept their intimacy? No, it's clearly an act of perversion. Similarly, homosexuality is also an act of perversion.. should not be legalized."
None-of-the-above,Itha thappunu sonna yeallarum mostly uneducated persons
Hope-Speech,Please.....salute the transgender because the have most kindness then us.....they also like us...they have  only transgender.....they also achieve more than us
None-of-the-above,Pon namer sent me people
None-of-the-above,Correct bro i supported and i agreed 😃😃
None-of-the-above,Oweww...... super 1 love never fails dass💖💓❤😘😘😘
Hope-Speech,yes I'm homosexual boythan
None-of-the-above,Another good topic
None-of-the-above,Saru chas  thanks sister
Hope-Speech,You are of high quality and Wise person respecting God's Creation. May God bless you for your revelation.
None-of-the-above,"Super akka one day I will Come to india so we can take selfi bro u will help me if I Come y I no hate just i like all Sister,aunty and amma 4 sweden"
None-of-the-above,"HE had already crossed that stage .....EACH and every time ...he's competing with his own performance and ..doing better !!😊so ,it's known he's doing great !😊👍"
Hope-Speech,sooo emotional i just cried😭 ... hat's off bro..
None-of-the-above,I'm waiting bro
None-of-the-above,I will write to pm cell to take action against this kind of activities
None-of-the-above,Anybody Madurai please give number
None-of-the-above,It's not a competition. Kandu pidichaa prize tharraangalaa?
None-of-the-above,She is beauty
Hope-Speech,Thanks  bro please all people see this video please respect gay people I love you soo mach  😘😘😘
None-of-the-above,I appreciate your open talk.in reality how many of ready to do agriculture work? You people prefer easy simple work.are you ready to go for agricultural work?
None-of-the-above,"I echo the thoughts of many viewers here - just can't happen in real life; not in TN at the moment. It was a superb movie, though"
None-of-the-above,Fast bro I am waiting
None-of-the-above,"5.18 wat sort of face reactn is that ashiq , try to maintain ur manners wid everyone , mitha actrss ta nala flirt panradhu , ivanga na 'iyo idu onnu' ah"
None-of-the-above,What a movie man so amazing I feel so bad that I missed this movie all these days hats off to the crew of this movie everything is perfect only few films give us a feel that it should not end or if the movie is little more big it would be nice in the list of mine I would keep this movie first I saw many comments too below but a awesome movie it's actually happening in lot more people's life
None-of-the-above,Bro plz make weed song in mind meditation plz explin
None-of-the-above,Waiting for part 2
None-of-the-above,Don't worry takekkuteece
None-of-the-above,Thank to Director Mani Shankar Iyer... Awesome script.. Superbbbbb direction. Excellent acting... Real feel.. Touching music... Hopefully they make a sequel too
Hope-Speech,Nice to 😘😘😘😘😘😘😘
Counter-speech,Super acting brother
None-of-the-above,Yes thank you
Hope-Speech,Nice to acting
None-of-the-above,Iam one of the freefire player please reply pvs gaming channel please support me
None-of-the-above,Spr people ga
Hope-Speech,Waiting too india accept LGBTQ  I'm straight but I found gay relationship is more true not wanting anything except just love this is my first time commenting in YouTube still I didn't use my true I'd so sad off
Hope-Speech,I don't follow ur language but I jst feel the imortions..I'm literally crying
None-of-the-above,Thank you for talking about this topic
None-of-the-above,I was actually searching for what he said  transgender until I heard her voice. She honestly doesn't look like that tho.. Even some girls have deep voice too❤️ She's beautiful.
None-of-the-above,Male and female being together is only natural na appo male and male & female and get being together yen nadakudhu; Pls open your mind😟😟😞😞
None-of-the-above,"Love is love, im very proud to say im in LGBTQ family."
None-of-the-above,You could explain things bold and clear..  Good..
None-of-the-above,Like her innocence
None-of-the-above,Really really great ..osm speach
None-of-the-above,Bro Vera leval acting bro
Hope-Speech,Really hats off...heart melting vedio....i can't ctrl my tears while seeing ...especially.7.15 _8.15 ...really good hearted antha akka....god bless u akka....have a bright future.....akka....
Homophobic,Shoot it now
None-of-the-above,dice prakash u still can migrate to moon. No one will go against nature there. But make sure bring enough oxygen along with u.
None-of-the-above,"Bible also bans things like round haircuts, football, divorce, wearing gold, any form of contraception, abortion, extra marital affairs, mixed fabric, shellfish and tattoos. ; So thomas Victoria, are you ready to stone to death all these sinners, if you are already not doing any of these? Please leave your inferior urge to judge people based on what they do inside their bedroom!"
None-of-the-above,no its not even Trump rejected thus act in usa
None-of-the-above,"Its just my view about this topic.; I agree all the things u told about science, psychology, religion and taught process of homosexual ppl.; All these things start at the same point as of my knowledge, bcoz a person's gene hav all the activities of their ancestors which includes everything like knowledge, arts,disease, physical appearance etc.., If we travel back to some 1000s of yrs back i wont be an issue with gene instead as psychology say it might be a practice of ppl living b4 which got into the gene and now its termed as the genetical change. I will not share my opinion as right or wrong abt this but i feel like this is not natural in early days which is natural. Thr was a genetical change happened due to the practice of thr ppl living long b4. ; That's all abt it"
None-of-the-above,Love is love i am also gay i am waiting for my gay life partner
Hope-Speech,Heart melted video bro promise sa na aluthuten
None-of-the-above,lgbt community people's don't change the society
Hope-Speech,Totally scripted 😴
None-of-the-above,Nonsense; The Ama said its Correct.; The Judge educated Right giving such laws
None-of-the-above,nice bro this is fct
Counter-speech,Sky Moon  first read about mankind..then read ur fucking bible....and the christianity is not from india..the place its origin they have already changed their laws....go and fuck with ur bible
Counter-speech,Bro no words to say  vera level bro keep going bro💕💕💕
Counter-speech,OMG this people's narrow mindset is ridiculous.... We all are human beings. we have our rights and choices to choose our sexuality! There's no shame to be a part of LGBT. PS: government has brain that's why our government made it legal!
None-of-the-above,brother talk about muthalog(muslim religion)
None-of-the-above,ok bro its clear what u said.ok then speak about gay.who is gay .difference between gay & thirunangai.
Counter-speech,Everyone have heart but some people have good thing to do ♥️; Another type of persons have 🖤 ; Same heart but not same thing
None-of-the-above,She is nice beautiful
Counter-speech,"jessienancy jessynancy ... we call shiva, u call him jesus... Some calls Allah... For all of us God is one... The one who ask us to love each other. Thanks for ur prayers for that akka... Everyone loves u too for ur goodness... ♥️"
None-of-the-above,Ashiq the way u treat it's so horrible...!
Hope-Speech,Really heart touching bro..
None-of-the-above,Are we life in  stone age life
None-of-the-above,Is great.....tq intha video pottathuku
None-of-the-above,Can't she pronounce ழ differently?😁
None-of-the-above,Such a beautiful movie 🖤
None-of-the-above,ram ram hi where R U plz Ur WhatsApp no
None-of-the-above,I am trying to start a job boutique  I need some employees  only transgender welcome because  my mom wish is to give a opportunity to them my mom is a kind hearted women ...
None-of-the-above,2.38 to 3.01 NAYANTHARA 😘😘😘😘
None-of-the-above,"Hai bro, ithudha na first time pakura prank show. Actually Enaku prank show pakrathu pudikathu because mathavangala emathi sandhoshapadrathu romba thapu. But unga channel vidio pakumbothu unmayave nalla irundhuthu and nalla message solirundhinga. All the very best TMP teams👏💐👏💐. And unga vidio la last ah mathavangaluku help panra vishayam romba touching ah irundhuchi. Inum nalla panunga TMP teams.  I support you💪💪 வாழ்க வளமுடன்."
None-of-the-above,Keerthana Jayavel ; Will u parents accept it
None-of-the-above,I am very crying
None-of-the-above,Whenever i watch dese movies ill always cry my heart out
None-of-the-above,Such a beautiful lady   she almost resembles old Nayantara
None-of-the-above,"Don't worry, it's nothing but love, only LOVE..... It's an awesome feeling"
None-of-the-above,Thirunangai Amma is great I Love you amma
None-of-the-above,I can crying only otherwise what can i can I do
None-of-the-above,Are you preparing for any competitive exam????
None-of-the-above,I cant understand the language .
None-of-the-above,This is even among animals and many other species. What country are you talking abt. Just foolish!
Counter-speech,"Everyone have there feeling please respect. We are polluting nature and speaking homosexual is unnatural. Come out of the box and respect everyone. Great speech from Malini. Anchor need to listen, understand and ask."
None-of-the-above,Hi madan ur speech is very attractive and useful to all... Kindly Speaks about todays affair Child Abuse and too warn the punishment under POCSO Act with recent ordinance...
None-of-the-above,Malini your thoughts and words are beyond the world your so great and i respect u so much.  Because ur a common human right dont consider people who speak non sense
None-of-the-above,Talk about Dutch boy bro.....
Counter-speech,Shimer Roshan fine .. hearing that ... seeing such a person who agrees ...n supports LGBT are real humans ..our generation should encourage being with such people ...great to hear it from u bro....keep rocking..
None-of-the-above,Then don't use Mobile phones transport system etc ...; Because all these are against nature ..; Causing damage to nature ...; 😂😂😂😂😂😂
None-of-the-above,I support ur rights ...but stop with the stupid abbreviations...
None-of-the-above,I know this dialogue reference😆😂
Hope-Speech,I'm a pansexual person.  I always wanna be like me and I like people not their GENDER!!!!!
None-of-the-above,"The great video ever , from malaysian respect u brother ❤️ Realy its heart touching video , always respect tirunangai ❤️🥰"
Homophobic,Homosexuality is against the will of God
None-of-the-above,Pathivukku nandri.. Feeling about this sister...
None-of-the-above,Bro live chatting la accept pannunga
None-of-the-above,People pon namer sent me
None-of-the-above,Malini ask questions why u can give answer because is true every body gives comments is very bad but u think after u get answers I support
None-of-the-above,"I want Katrina number,; Please help me."
Counter-speech,Tn government pls take action
Counter-speech,RishiPedia  ☑  how can u literally abuse someone.u don't have the right to abuse anyone
None-of-the-above,Galatha and southscope same channel
Homophobic,"It's totally wrong,don't compare Western  country r us,judge oru mental paaya."
None-of-the-above,horror films tamil  y ipdi reaction
None-of-the-above,Mohan kumar if i hurt sry i want to knw tat reason
Counter-speech,mr. jaai I'm really happy to see your kindness for giving poor ppl. plz dont show their face .
None-of-the-above,Ak Be The Change  I don't think it's good ..it's my opinion
Hope-Speech,Neenga panna act and avanga sonna msgs ellame supera irundhudhu anna ! Channel vera level vara podhu innum konjam naal laye !🤗🤗we are welcomes you ! ❤❤next step of growing thank you so much.......🤗🤗😁😁🥰🥰🥰
None-of-the-above,Really  akka and Anna your are a great people
Hope-Speech,Hatts off youngster's..
None-of-the-above,She Is So Beautiful ❤❤❤ ....; 11:06 Bonda Ma3 Iruka Ashiq 🤣🤣
None-of-the-above,Any lesbians or gays here👍
Counter-speech,I really appreciate the madam who is caring him like a mother😍...I really felt abt transgender😢....
None-of-the-above,Proud of you macha
Counter-speech,Hats off bruh 👏👏👏
None-of-the-above,Whether you may be a bisexual/gay/lesbian/straight. It's a lifestyle and character. Be truth to ur partner. That is important.
None-of-the-above,At a glance she's looking like Shalini Pandey
None-of-the-above,Who cry when she dance for him...; Yes I'm crying.
None-of-the-above,Please tell about the Nazi bell
Hope-Speech,Nice nanba👌👌 really heart touching 😭😭😭 tmp super pls give respect to them
Hope-Speech,Part 2 waiting
Counter-speech,Ithana naal sirichu sirichu aluthen unga video paathu inikku aana apdi ae maathitinga bhaa❤️ best ever video bhaa😭 ❤️ antha awareness kondu vantinga ponga ✨ all the best team ❣️
Hope-Speech,This only one video my full support 😍
Counter-speech,Anna  really nice; Today  I am your fan
Counter-speech,Very relatable story.; ; I'd also like to point out a few more arguments against forcing gay male children to marry a girl against their wishes and nature. Parents should think that the girl's like is also being ruined. Most Indian families take it for granted that the girl can be subject to this kind of cheating and humiliation.; ; Thanks Mani Shankar for this film.
None-of-the-above,education system pathi video pannuga bro
Counter-speech,Plz all should share and respect ever Transgender equal in our society ❤❤❤❤❤❤❤❤❤
None-of-the-above,Karthik  how are you bro
None-of-the-above,is it necessary to interview these kinds of people???..nonsense..feels disgusting
None-of-the-above,thanks a lot for your comments; do share & subscribe
None-of-the-above,Bro small correction it is not article it is section 377 IPC
None-of-the-above,Caption is true ?!?! ; ; Doesn’t look like transgender. Any typo ?!
None-of-the-above,Brow ...! I love ur act !!!!❤️✨ Such a natural Act ❤️❤️😻🔥💯
None-of-the-above,how to become a professional socccer player plz bro
None-of-the-above,Ishvar Mahendiran... 😊no.. I m not talking about external.. (Not about beauty at all). ; This world wud look at these ppl differently for sure as they see the transgender.!! ; ; Can u change the world of T ransgenders? Same way u cant change the people's perception!!!. Everything has been inside the blood. U cant change!
Counter-speech,Ur last point is right.... don't forced them to get married...it will spoil their life and their partners....
None-of-the-above,I am a sri lanak born I talk tamil tamil Nadu not English country very sad for you all
Hope-Speech,While it may be true that God created Adam and Eve he only created them to populate the Earth and there are 7.7 billion people on this Earth now 😐 I just think we should all be kind to each other and live our lives how we wish as long as we aren't hurting anyone 😊
None-of-the-above,My name ramesh my number WhatsApp
None-of-the-above,"People have their own decision to choose what they want in their life.., only idiots and stupids alone poke their nose into others life.. like wise an educated guys who grown up in a liberty environment talked as positive and others having a thought of ditch.."
None-of-the-above,Wow super story; Best wishes both of u act in this; Short story. We expect more stories from ur side.; From cochin kerala; From
Counter-speech,Brother really super super super super super super super super
Homophobic,That's y no rains...
None-of-the-above,Thanks for making this movie 🙏
Hope-Speech,She is saying samy samy🤗 he is really God 😎🙏🙏🙏🙏🙏
None-of-the-above,Anis Jackson you are guy lover yes or no
None-of-the-above,Video about bharathiyar
None-of-the-above,akka really you are great...
Hope-Speech,She is a good human being 💯💖
Hope-Speech,Rich in humanity
Counter-speech,1st u should understand different types of peoples and their feelings... In this humanity dnt have religion and all... Its a nature... Every human soul blood having the same color... Then why u differential people's feelings...
None-of-the-above,I need full fight please upload
None-of-the-above,"Bro don't search for any relationship. If it means to you, it will come to you at right time. Till that love yourself and create yourself for better person."
None-of-the-above,"Why actors only doneted more money only trending society problem person,,why r they r help baggers u also behindwoods"
None-of-the-above,I don't understand why are you in my recommended
Counter-speech,Well said. Totally it’s chromosomes disorder. Human cannot change by themselves. We should give respect to them. I can see some comments people lack of biological disorders.
Counter-speech,The honest love story.; See Love is beautiful in any form..; I am a Gay ...; I have a love and life...; We both cried watching this film.
None-of-the-above,Good message ; & thank you so much anna
None-of-the-above,Respectable and caring.
None-of-the-above,She is great 🙏
Hope-Speech,Great awareness video which I had ever seen....👍👍👍💫💯 congrats brother keep doing...
None-of-the-above,unga vedhainai ya kekave kastama iruku.... unga confidence romba azhaga iruku.... stay positive... all the best.... my support is there for you always....
None-of-the-above,This Video Shows the Value of Transgenders & also the humanity.. Hats off u GuyZzz😍😍Thanks 4 the Creative Prank Video 😍😍It's Really Shows the Womens Care & Love😍She Dance 4 him😍😍She is a Wonderful Mom & Sisters 4 every people🤗🤗🤗Happy 2 C this
None-of-the-above,Why you people are even  mentioning her as a transgender ....it's so rude...she is a beautiful woman...and more that that..
None-of-the-above,facts that she pointing out made me watch till the end. sorry i have Yoda english
None-of-the-above,Really awesome story...
None-of-the-above,She looks cute and beautiful
None-of-the-above,It's really good..
Counter-speech,According to the Bible the very 1st and only  human beings created on the earth are Adam & Eve.; Ok let them had sex and gave birth to their children.; How the next generation moved further?; Did their Children had sex with each other and gave birth so?; Please stop showing the religious beliefs as an example. I'm not against the religions.; Either accept the nature or don't blame it. This is how we were born in this Earth.; May god help you in understanding the sexuality of human.
Homophobic,Parcel to pakistan and shoot
None-of-the-above,Change the title. Don't mention her gender
None-of-the-above,I love you so much dream girl
None-of-the-above,"1M subs confirm all the best, kondalampatty"
None-of-the-above,Contact me balureddythirupur
Counter-speech,"Best ,shows the real helping tendency ,hats off"
None-of-the-above,Yes it's TRUE buddy
Hope-Speech,Very nice short film. Except at workplace he should have laptop in front of him instead of newspaper. (just joking)
None-of-the-above,Homosex against gods creation punishment is unavoidable
None-of-the-above,Bold and Beautiful 👍👌
None-of-the-above,90 percent: another language ; 10 percent: English
None-of-the-above,gud.. speech..very rare people touching those type of topics
None-of-the-above,Identify what? Should they hide it?
None-of-the-above,Aksh Aksh  thank you
None-of-the-above,She is a girl!!!
